id;recipe_id;step_number;step_description
1497;346;3;Pendant que vos citrouilles cuisent, épluchez et coupez l'oignon. Versez-le dans une poêle chaude avec de l'huile d'olive. Une fois doré, versez un fond d'eau. Juste ce qu'il faut pour recouvrir les morceaux d'oignon. Ensuite coupez en lardon vos tranches de bacon et ajoutez-les dans la poêle quand l'eau est totalement absorbé et les oignons fondant. Faites dorer le bacon et versez la crème de soja.Enfin assaisonnez la préparation avec du sel, poivre et du paprika. Mélangez.
1498;346;4;Préchauffez le four à 210°C.Disposez vos petites citrouille dans un plat à gratin chemisé de papier de cuisson. Versez cette préparation dans des citrouilles. Cassez l'oeuf et versez-le dans la citrouille. Salez et poivrez puis enfournez pendant 10-15 min. La cuisson est terminée une fois que l'oeuf est cuit.
1499;346;5;Servez ensuite les citrouilles farcies avec leur chapeau accompagné de pâtes complètes par exemple et dégustez.
1500;346;6;Vous pouvez également servir ces citrouilles gratinées avec du parmesan râpé.
1501;347;1;Préchauffez le four à 200°C.Commencez par couper en deux votre courge spaghetti, puis videz les pépins à l’aide d’une cuillère à soupe. Badigeonnez la chair d’huile d’olive, de sel et le poivre.Disposez vos moitiés de courge dans un plat à gratin, côté peau contre celui-ci. Recouvrez-les de papier d’aluminium et enfournez pendant 40 minutes.Épluchez puis émincez votre oignon. Versez-le dans une sauteuse avec de l’huile d’olive à feu moyen. Une fois l’oignon doré, versez un fond d’eau pour ramollir celui-ci. Une fois que celle-ci est absorbée, préparez votre courge.Ensuite à l’aide d’une fourchette grattez la chair de la courge et versez-la dans la sauteuse avec l’oignon. Versez le lait de votre choix et assaisonnez à votre convenance de muscade, coriandre, cumin, sel et poivre.Ajoutez ensuite mes marrons cuits coupés en morceaux et les noix hachées grossièrement. Laissez cuire en mélangeant de temps à autres pendant 10 à 15 minutes.Préchauffez le four à 200°C.Versez le mélange dans un plat à gratin, étalez de manière uniforme et faites 4 trous pour recevoir vos oeufs. Cassez chaque oeuf et versez-les dans les trous. Saupoudrez encore d’un peu de marron et de noix, puis enfournez pendant 15-20 minutes jusqu’à ce que les oeufs soient cuits. Vous pouvez ajouter un peu de ciboule hachée avant d’enfourner votre plat. La cuisson terminée, disposez votre plat à gratin sur la table et dégustez aussitôt.
1502;347;2;Une jolie variante pour cette recette? Vous ne mettez pas de marron mais des champignons à la place, type champignons de Paris ou cèpes et vous ajoutez du parmesan râpé. Gratin gourmand et savoureux garanti!
1503;348;1;Pour réaliser ce gratin commencez par couper le brocolis en bouquets et faites le cuire au cuiseur vapeur pendant 35 min. Ensuite dans un autre panier ajoutez vos filets de poulet que vous ferez rapidement cuire pendant 20 min.La cuisson terminée, huilez votre moule à gratin avec de l’huile d’olive, puis versez la moitié de vos brocolis au fond. Mettez la moitié de votre filet de poulet coupé en morceaux. Égouttez les boules de mozzarella et coupez-les en morceaux. Versez la moitié sur le poulet. Rincez les tomates cerises et coupez-les en deux. Versez la moitié sur la mozzarella. Ensuite coupez le pied de vos champignon, puis coupez-les en lamelles. Disposez la moitié sur la mozzarella.Dans un récipient versez le pesto, les oeufs, la crème et assaisonnez en sel et poivre. Fouettez le mélange jusqu’à ce qu’il soit homogène. Puis versez la moitié dans le moule à gratin. Mélangez rapidement dans le moule avec une fourchette pour bien répartir le mélange aux oeufs.Préchauffez le four à 180°C.Enfin versez le reste de brocolis, de poulet et de tomates. Ajoutez la mozzarella, les champignons et versez le reste de mélange aux oeufs. Mélangez rapidement avec une fourchette pour que tout les ingrédients soient bien au contact de la préparation aux oeufs.Enfin enfournez la préparation et mettez au four pendant 1h20. Le brocolis rejettent encore de l’eau pendant la cuisson, et le gratin étant conséquent vous devez avoir une cuisson longue et surtout ne pas mettre plus de 180°C.
1504;348;2;Ce gratin est également une recette anti gaspillage car j’ai utilisé du pesto qu’il me restait d’un précédent repas. Vous pouvez ainsi utiliser du pesto maison ou non. Mais également un reste de sauce tomate, de tapenade ou de pesto Rosso.
1505;349;1;Versez dans un récipient, un fond d'eau tiède et ajoutez la levure. Laissez celle-ci s'activer pendant 5 min puis ajoutez la farine avec le sucre, l'huile et le sel. 
1506;349;2;Ajoutez le reste d'eau, mélangez et pétrissez la pâte jusqu'à ce qu'elle soit souple et homogène. Filmez le récipient et laissez la pâte pousser pendant 1h30. 
1507;349;3;Divisez la pâte en 4, réalisez ensuite à l'aide d'un rouleau une forme ovale bien allongée et ajoutez sur un côté un carré de papier sulfurisé, repliez la pâte sur celui-ci. 
1508;349;4;Laissez pousser pendant 30 min. Ensuite disposez tout de façon espacé dans le/les paniers du cuiseur vapeur et lancez 25 min de cuisson.
1509;349;5;Pour la garniture, j'ai simplement ajouté une sauce au fromage blanc et j'ai ajouté salade, viande de boeuf cuite et des légumes revenus à la poêle avant avec de l'huile d'olive. 
1510;350;1;Coupez le poulet et faites-le mariner dans un mélange de paprika, moutarde et miel. Laissez mariner 1h minimum.
1511;350;2;Mixez l'avoine et ajoutez-y le thym et le paprika.
1512;350;3;Enrobez le poulet mariné dans les flocons d'avoine. Ajoutez de l'huile d'olive sur la plaque du four, ajoutez le poulet dessus et enfournez 15 min à 200°C. Retournez le poulet et prolongez la cuisson de 15min. 
1513;350;4;Épluchez et coupez les légumes. Faites cuire à la vapeur les bouquets de brocolis et la carotte coupée en bâtonnets. 
1514;350;5;Faites revenir dans de l'huile d'olive les oignons. Réservez .
1515;350;6;Sur le wrap ajoutez la sauce, mélange de fromage blanc, jus de citron et sel selon vos goûts. Ajoutez la salade hachée, les différents légumes et le poulet. Refermez le wrap et dégustez aussitôt. 
1516;351;1;Mélangez les tomates confites mixées avec de la crème, les différentes épices et sel, le poulet cuit à la vapeur et effiloché avec des fourchettes, les oignons cuits avec de l'huile d'olive et enfin le fromage. Mélangez.
1517;351;2;Découpez la moitié du diamètre du wrap, ajoutez sur chaque quart les épinards et le poulet en alternant. Repliez et faites toaster dans une poêle. Dégustez aussitôt avec une sauce au yaourt assaisonnée avec ail, persil et sel. 
1518;352;1;Dans 2 recipients différents, ajoutez des côtés les gousses d'ail épluchées et assaisonnez en sel et huile d'olive.
1519;352;2;Et de l'autre placez les tomates et assaisonnez en sel, jus de citron, ail et thym.
1520;352;3;Enfournez les 2 pendants 35-40 min chaleur tournante à 200°C .
1521;352;4;Pendant ce temps, toaster le pain rapidement recto verso à la poêle avec un peu d'huile d'olive.
1522;352;5;Ajoutez sur 2 tranches les gousses cuites et fondantes. Ajoutez ensuite les tomates et mozzarella. Refermez le sandwich, finissez de la toaster pour faire fondre un peu le fromage et dégustez avec des noix de cajou concassées. 
1523;353;1;Hachez le chou chinois et égouttez les tomates confites. Coupez-les grossièrement .
1524;353;2;Mélangez le lait avec la farine, l'huile et le bouillon. Mélangez et ajoutez les tomates et fromage. Mélangez.
1525;353;3;Ajoutez enfin le chou. Mélangez et ajoutez l'équivalent d'une bonne c. à soupe dans le gaufrier et ainsi de suite. 
1526;354;1;Découpez de belles tranches de pain et faites des toasts et dans une poêle avec un peu d'huile d'olive. Une fois que le pain est grillé recto et verso, tartinez avec du pesto fait maison où du pesto de qualité. 
1527;354;2;Ajoutez ensuite une belle tranche de jambon sec bien parfumé, quelques morceaux de fromage de chèvre, des pignons et refermez.
1528;354;3;OptionAjoutez sur le dessus un oeuf poché et degustez. 
1529;355;1;Lavez et coupez finement les légumes. Faites-les revenir dans une poêle avec de l'huile d'olive, paprika, sel et herbes . Une fois cuits, ajoutez la viande et les olives. 
1530;355;2;Mélangez et ajoutez la sauce tomate. Mélangez et faites réduire un peu. 
1531;355;3;Réalisez ensuite les samoussa comme sur la vidéo (pliage des bricks habituelles).
1532;355;4;Enfin faites-les griller sur une poêle grill et dégustez .
1533;356;1;Versez l'eau tiède et la levure, mélangez et laissez celle-ci s'activer pendant 5 min. 
1534;356;2;Ajoutez ensuite la farine, l'huile et le sel. Mélangez et pétrissez. Une fois homogène, laissez reposer à l'abris des courants d'air pendant 1h30. 
1535;356;3;Façonnez la focaccia comme sur la vidéo à la main, ajoutez de l'huile d'olive dessus (on peut même faire une 2eme pousse de 30 min à ce moment).
1536;356;4;Ajoutez le pesto, les tomates, olives et pignons puis enfournez à 170°C pendant 20-25 min. Le résultat doit être moelleux et légèrement doré. 
1537;357;1;Tartiner le fromage frais sur les wrap puis émiettez le thon cuit par dessus. Assaisonnez selon beaucoup avec du sel et ajoutez des pignons de pin avec les olives. 
1538;357;2;Ajoutez un peu de fromage râpé, replier les wrap et coupez lesen deux. Ajoutez un peu de fromage râpé sur le dessus puis enfourner en position grill à 200C° pendant 10 minutes.
1539;358;1;Mélangez la bière tiède avec la compote et l'oeuf. Fouettez et ajoutez la levure. 5 min plus tard, ajoutez le sucre, la farine et le sel. Mélangez et petrissez.
1540;358;2;Faites lever la pâte à l'abris des courants d'air pendant 1h30.
1541;358;3;Pendant ce temps coupez les bouquets de choux-fleur. Faites-les cuire à la vapeur. Une fois fondants, ajoutez-les dans le wok avec du ghee. Ajoutez alors la crème, le curry, le sel, l'ail, le paprika et le cumin. Surtout assaisonnez-bien pour le goût. 
1542;358;4;Une fois que la préparation est crémeuse, arrêtez et laissez refroidir. 
1543;358;5;Saupoudrez de farine le plan de travail, divisez la pâte en 6 et au centre ajoutez la préparation et refermez. 
1544;358;6;Disposez les brioches dans le panier vapeur. Utilisez du papier de cuisson pour le fond du panier et pour éviter que les brioches ne se touchent. 
1545;358;7;Enfin poêler avec de l'huile ou du ghee pour faire dorer les brioches recto verso. 
1546;359;1;Lavez les légumes puis coupez en dés le poivron et l'aubergine. Épluchez et ciselez finement les oignons. Versez dans une casserole le poulet et recouvrez tout juste d'eau. 
1547;359;2;Ajoutez le bouillon et mélangez. Une fois que le poulet est blanchi ajoutez un peu de beurre clarifié et versez ensuite les oignons, poivrons et aubergines. Mélangez. Ajoutez du beurre ou de l'huile d'olive.
1548;359;3;Enlevez le poulet et effilochez-le à l'aide de deux fourchettes et reversez le dans la préparation. Ajoutez un peu de matière grasse si nécessaire et mélangez le tout. On doit obtenir un poulet tendre et des légumes qui fondants.
1549;359;4;Pendant ce temps versez dans un wok les échalotes finement coupées avec les tomates cerises. Assaisonnez généreusement d'ail, de paprika, de jus de citron, de sel et d'huile d'olive. 
1550;359;5;Mélangez. Une fois que les tomates cerises sont cuites, écrasez-les et continuez un petit temps la cuisson. Ensuite versez le tout dans un mixeur et réduisez la préparation en sauce homogène.
1551;359;6;Versez au centre du wrap la préparation au poulet, par dessus un peu de sauce et enfin ajoutez du fromage généreusement. Repliez le wrap et faites le toaster recto-verso dans une poêle avec la matière grasse de votre choix. 
1552;360;1;Coupez le chou-fleur en petits bouquets puis badigeonnez-le avec un mélange de paprika, pâte de curry, huile d'olive et sel. 
1553;360;2;Disposez les bouquets sur la plaque du four et faites cuire le tout pendant 25 minutes environ à 200°C. Disposez le blanc de poulet sur le wrap avec des champignons préalablement cuits à la poêle avec un peu d'huile d'olive. 
1554;360;3;Ajoutez le chou-fleur rôti, parsemé de fromage râpé et repliez le wrap comme sur la vidéo. Faites-le cuir dans un grille-pain, dans un gaufrier ou a la poêle recto-verso.
1555;361;1;Faites cuire le poulet dans de l'eau bouillante avec un peu d'huile d'olive, quand celui-ci est blanchi hachez et effilochez-le à l'aide de deux fourchettes. 
1556;361;2;Versez ensuite le poulet dans un wok avec de l'huile d'olive et les champignons coupés en morceaux. Une fois que tout est cuit, arrêter la cuisson et ajoutez la ricotta et la pâte de curry mélangés jusqu'à obtenir une préparation homogène. 
1557;361;3;Au centre du frappe ajouter la préparation puis par-dessus les cornichons coupés en morceaux et enfin le fromage râpé au choix. Repliez le wrap et faites-le cuire au gaufrier avant de le couper en deux. 
1558;362;1;Faites revenir le saumon coupé en morceaux avec les oignons ciselés, l'huile d'olive et les graines de cumin. 
1559;362;2;Une fois que tout est cuit, ajoutez la crème. Versez la préparation au centre d'un grand wrap, ajoutez par-dessus des petits pois et enfin le fromage de chèvre. 
1560;362;3;Repliez le wrap avec un autre sous forme de galette et enfin faites cuire le tout recto-verso dans une poêle avec un peu d'huile d'olive. 
1561;363;1;Coupez le poulet en morceaux, faites-le revenir avec les oignons ciselés, l'ail et de l'huile d'olive. 
1562;363;2;Une fois que la viande est dorée, ajoutez les épinards, avec la crème de soja, le bouillon et le fromage à feu doux.
1563;363;3;Quand le fromage est fondue, arrêtez la cuisson. Garnissez les wraps, pliez-les et faites-les griller à la poêle, au barbecue ou au four. 
1564;364;1;Versez dans le mixeur l'huile d'olive avec les pignons de pin, le parmesan, l'ail et les épinards frais. Mixez jusqu'à obtenir un pesto bien homogène. 
1565;364;2;Coupez le pain en deux puis ajoutez le pesto à l'intérieur avec le poulet préalablement grillé avec un peu d'huile d'olive, les tomates séchées, les épinards coupés, les concombres et saupoudrez de pignon de pin avant dégustation. 
1566;365;1;Versez dans un récipient la levure avec un peu d'eau tiède. Mélangez et laissez celle-ci s'activer pendant cinq minutes. Ajoutez ensuite la farine, le sel, l'huile, le sucre, l'œuf et le reste doux. 
1567;365;2;Mélangez et pétrissez la pâte jusqu'à ce qu'elle soit bien souple et homogène. Laissez celle-ci pousser dans le four éteint pendant deux heures minimum. 
1568;365;3;Divisez la pâte en quatre morceaux et réaliser des petits pains. Versez les dans l'eau bouillante avec le bicarbonate et le sel. 
1569;365;4;Comptez une dizaine de secondes pour chaque petit pain pas plus. Disposez-les sur la plaque du four. Badigeonnez avec un jaune d'œuf et réalisez des entailleq avec un ciseau. 
1570;365;5;Enfourner à 190°C pendant 20 minutes. Laissez refroidir puis couper les petits pains et ajoutez dedans la garniture au choix.
1571;365;6; Pour ici j'ai choisi du chèvre frais avec du saumon fumé, des cornichons à l'aigre-douce, du jus de citron et enfin un peu d'ail. À déguster aussitôt pour l'apéritif en petite portion ou comme un sandwich. 
1572;366;1;Versez la levure dans l'eau tiède et laisser celle-ci s'activer pendant 5 minutes. Ajoutez ensuite la farine avec la semoule, l'huile et le sel. Mélangez et pétrissez la pâte jusqu'à ce qu'elle soit souple et homogène. Laissez la pâte se lever pendant deux heures.
1573;366;2;Ensuite divisez-là en six et abaissez là tout en ajoutant au centre des ronds de pâtes du brocoli cuit a la vapeur, du chèvre et l'assaisonnement selon vos goûts.
1574;366;3;Refemez les pain et faites-les cuire sous couvert à la poêle recto verso. Dégustez aussitôt. 
1575;367;1; Mélangez tous les ingrédients jusqu'à obtenir une pâte bien homogène. Diviez en cinq portions égales puis abaissez avec un rouleau à pâtisserie pour obtenir une crêpe fine de 5 mm d'épaisseur environ. 
1576;367;2;Ensuite faites cuire vos wraps dans une grande poêle sans matières grasses. Attention la cuisson est très rapide. Retournez souvent votre wrap jusqu'à obtenir une fine pellicule blanche pour conserver un wrap bien souple. 
1577;367;3;Dans une grande poêle ajoutez les champignons puis le poulet avec un peu d'huile d'olive. Une fois que tout est doré, ajoutez la crème. Laissez celle-ci s'imprégner des arômes des ingrédients. 
1578;367;4;Ensuite assaisonnez avec du parmesan, de l'ail et du sel. Mélangez jusqu'à obtenir une sauce bien crémeuse et des ingrédients cuits.
1579;367;5;Ajoutez au centre du wrap un peu de feuilles d'épinards avec le poulet à la crème, les cuillères de ricotta placées ici et là et enfin les pignons de pin grillés ou non. 
1580;367;6;Refermez le wrap. Vous pouvez le faire toaster de nouveaux à la poêle une fois plié ou alors le déguster tel quel. Bon appétit !
1581;368;1;Versez dans un récipient l'eau à température ambiante avec la levure. Mélangez et laissez celle-ci s'activer pendant 5 minutes. Ajoutez ensuite la farine avec le sel et l'huile d'olive. Mélangez et pétrissez la pâte jusqu'à ce qu'elle soit souple et homogène. 
1582;368;2;Laissez la lever dans un endroit à l'abri des courants d'air pendant une heure. Divisez la pâte en trois morceaux égaux et réalisez des boules. Disposez-les sur une plaque de cuisson et faites-les deux nouveaux lever pendant 30 minutes. 
1583;368;3;Passé ce temps saupoudrez de farine, réalisez une petite entaille sur le dessus et enfourner à 180°C pendant 25 minutes environ.
1584;368;4;Rincez les pois chiches et mixez-les jusqu'à obtenir une purée homogène. Ajoutez alors les oignons épluchés et finement émincés avec la levure maltée, l'œuf et enfin assaisonnez selon vos goûts avec de l'ail, du paprika et du piment. 
1585;368;5;Versez la préparation dans trois emporte-pièce pour réaliser de jolies galettes puis enfourner à 180°C pendant 30 minutes.
1586;368;6;Dans un récipient mélangez la ricotta avec le jus de citron, le sel et enfin les cornichons finement coupés.
1587;368;7;Couper les pains en deux, tartinez de sauce ajoutez ensuite les jeunes pousses d'épinards avec des morceaux de cornichons et des oignons rouges et enfin disposez le steak végétal. Refermez le burger et déguster aussitôt.
1588;369;1;Versez dans un récipient un fond d'eau avec de la levure. Laissez celle-ci s'activer pendant cinq minutes puis ajoutez le reste des ingredients. Mélangez jusqu'à obtenir une pâte homogène.  Disposez celle-ci dans un endroit à l'abri des courants d'air et faites lever pendant 1h. 
1589;369;2;Lavez et découpez le chou kale. Coupez la tige centrale et faites le cuire à la vapeur.
1590;369;3;Ajoutez dans un récipient le paprika, l'ail, des herbes et le sel. Mélangez puis ajoutez les petits bouquets de chou-fleur. Mélangez puis versez sur la grille du four, enfourner à 200°C pendant 30 minutes jusqu'à ce qu'ils soient dorés et fondants. 
1591;369;4; Pour la sauce mélangez simplement le parmesan Rapé, l'ail, le sel et les herbes.
1592;369;5;Après avoir réalisé tout cela, dégazer la pâte de la pita et divisez-là en 4  pâtons égaux. Ensuite abaissez chaque pita sur une épaisseur de 5 mm et faites-les cuire à la poêle recto-verso. Coupez-la en deux et garnissez chacunes d'elles avec la sauce, le chou kale, le chou rôti et le poulet simplement cuit à la poêle. Dégustez.
1593;370;1;Coupez le brocoli en bouquets et coupez le chou cale pour enlever la tige centrale. Faites cuire vos légumes à la vapeur pendant 30 minutes jusqu'à ce qu'ils soient fondants. 
1594;370;2;Faites-les revenir dans une poêle avec un peu de beurre clarifié et du bacon coupé en morceaux, pendant quelques minutes. Ajoutez enfin la crème et le Comté et assaisonnez selon vos goûts avec de l'ail et du sel. Laissez refroidir. 
1595;370;3;Versez l'équivalent de deux grosses c. à soupe de garniture sur un wrap et étalez en couche homogène, ajoutez un deuxième wrap sur le dessus puis faites cuire cette grosse galette recto-verso dans une poêle avec un peu d'huile d'olive ou de beurre clarifié. Coupez en part et dégustez aussitôt. 
1596;370;4;Vous pouvez dans le même esprit mettre d'autres légumes de saison ou ne pas mettre de bacon pour une version végé.
1597;371;1;Versez dans un récipient l'eau à température ambiante avec la levure. Mélangez et laissez celle-ci s'activer pendant 5 min puis ajoutez la farine, l'huile d'olive et le sel. Mélangez et pétrissez la pâte jusqu'à ce qu'elle soit bien homogène puis filmez le récipient et disposez-le dans un endroit à l'abri des courants d'air pendant 1h30 minimum comme le four éteint par exemple. 
1598;371;2;Pendant ce temps lavez, coupez et videz le Butternut. Coupez-le en petits cubes puis épluchez et émincez finement l'oignon rouge. Coupez également les aiguillettes de poulet en morceaux.
1599;371;3;Faites revenir le Butternut avec un peu d'huile d'olive puis ajoutez les oignons. Une fois que le Butternut commence à être fondant, ajoutez les morceaux de poulet. Le poulet une fois blanchi, ajoutez la crème et assaisonnez selon vos goûts avec du sel et des épices. Mélangez puis laissez mijoter et laisser réduire un peu la crème. Mettez de côté et laissez refroidir. 
1600;371;4;Divisez la pâte en quatre, abaissez à l'aide d'un rouleau à pâtisserie en forme de rectangle et ajoutez au centre la garniture. Attention à ne pas ajouter trop de garniture pour que celle-ci ne déborde pas lors de la cuisson. Refermez ensuite la pâte sur la garniture. 
1601;371;5;Versez dans une cocotte ou une grande casserole, l'eau avec le bicarbonate. Montez l'eau à ébullition puis ajoutez un par un les pains confectionnés précédemment. Laissez chacun d'eaux l'équivalent de 10 à 15 secondes puis disposez-les sur la plaque du four. Badigeonnez les d'oeufs battus et saupoudrez de graines de sésame. 
1602;371;6; Enfourner à 180°C pendant 15 minutes. Laissez refroidir puis déguster. 
1603;371;7;Gardez une épaisseur de 1cm environ de pâte. Ne les garnissez pas trop pour éviter qu'ils ne s'ouvrent lors du bain de pochage.
1604;372;1;Versez dans un récipient la bière et le yaourt à température ambiante avec la farine, la levure de boulanger et le sel. Mélangez et pétrissez la pâte jusqu'à ce qu'elle soit souple et homogène. 
1605;372;2;Ensuite filmez le récipient et disposer le dans un endroit à l'abri des courants d'air comme le four éteint pendant 1h30 minimum. Passez ce temps divisez la pâte en quatre et abaisser chaque morceau à l'aide d'un rouleau à pâtisserie. 
1606;372;3;Ajoutez au centre les tranches de bacon et le fromage Rapée puis enroulez chaque morceau.
1607;372;4;Pour une cuisson à la poêle: mettez-les sur feu fou et faites-les cuire sur toute les faces à couvert.Pour une cuisson au four: optez pour 15-20 min env. à 180°C pour un effet plus brioché.
1608;372;5;N'hésitez pas à varier les garnitures, c'est fait pour !
1609;373;1;Épluchez et faites cuire les pommes de terre à la vapeur jusqu'à ce qu'elle soit fondante. Ensuite versez-les directement dans le robot et fouettez la préparation. 
1610;373;2;Vous verrez qu'une purée se formera naturellement. Ajoutez ensuite directement l'huile d'olive avec le sel, l'ail et le persil selon vos goûts. Une fois la purée homogène ajoutez la farine dans le robot. Mélangez et  pétrissez la pâte jusqu'à ce qu'elle soit homogène. 
1611;373;3;Divisez la pâte en neuf portions. Abaissez chaque morceau avec un rouleau à pâtisserie en forme de rond. Ajoutez au centre un morceau de reblochon et une tranche de bacon puis repliez en portefeuille. 
1612;373;4;Écraser légèrement avec la paume de la main puis faites tester dans une poêle avec un peu d'huile d'olive chaque chaussons. Déguster aussitôt. 
1613;373;5;N'hésitez pas à ajouter des aromatiques dans la pâte du chausson. 
1614;375;1; Versez dans un récipient l'eau tiède avec la levure. Mélangez puis ajoutez la farine avec l'huile et le sel. Mélangez et pétrissez la pâte jusqu'à ce qu'elle soit bien souple et homogène. Filmez le récipient puis disposez-le dans un endroit à l'abri des courants d'air pendant 1h30 comme le four éteint par exemple. 
1615;375;2;Pendant ce temps, lavez et coupez finement le poireau. Faites-le cuire à la vapeur jusqu'à ce qu'il soit fondant. Versez-le dans un dans une poêle chaude et faites-le suer. 
1616;375;3;Ajoutez ensuite du bacon avec de la crème et du bouillon de légumes. Mélangez. Une fois que la fondue de poireaux est crémeuse, ajoutez le parmesan sur feu doux. Mélangez puis laissez complètement refroidir.
1617;375;4;Divisez la pâte en quatre. Abaissez-là à l'aide d'un rouleau à pâtisserie en forme de cercle puis ajoutez au centre un tas de garniture. Repliez la pâte en deux et pincez les bords à l'aide d'une fourchette. 
1618;375;5;Disposez les chaussons sont sur la plaque du four chemisé avec du papier de cuisson, ajoutez un peu d'huile d'olive ou de lait sur la pâte. Enfournez à 180°C pendant 20 minutes.
1619;375;6;J'ai utilisé des poireaux mais ils il est bien sûr possible d'ajouter d'autres garnitures avec d'autres légumes. 
1620;376;1;Égouttez et émiettez le thon. Versez-le dans un récipient avec le fromage frais et les tomates confites égouttées et hachées. Mélangez la préparation. 
