id;recipe_id;step_number;step_description
693;147;6;Au centre versez la farce et repliez comme un portefeuille. Pincez les bords, badigeonnez d'huile d'olive et faites-les cuire dans une poele recto verso.
694;147;7;Sur le meme modèle, vous pouvez mettre du saumon, du Roquefort, du fromage rapé, du kale ou du choux haché. 
695;148;1;Décortiquez vos crevettes et reservez. Puis faites trempez vos tagliatelles pendant 10 minutes dans de l'eau froide.
696;148;2;Pendant ce temps, épluchez et émincez l'oignon. Puis épluchez et pressez la gousse d'ail. Faites-les revenir à feu doux avec de l'huile de sésame. Une fois cuits, ajoutez la crème de soja, la pate de curry, le gingembre, les pousses de bambous et sel selon vos gouts.
697;148;3;Mélangez la préparation, puis ajoutez l'ecorce de citron rapé et son jus. 
698;148;4;Versez ensuite les crevettes et faites-les cuire quelques minutes pour qu'elles s'impregnent bien.
699;148;5;Ajoutez les tagliatelles bien égouttées et mélangez. Quand la préparation est crémeuse, servez aussitot avec un peu de persil frais sur le dessus.
700;148;6;Ajoutez le citron avec parcimonie et goutez au fur et à mesure.
701;149;1;Dans un récipient versez l'oeuf, l'huile d'olive et le sel. Fouettez puis ajoutez la farine et l'eau tiède. Mélangez et petrissez la pate jusqu'à ce qu'elle soit bien homogène.
702;149;2;Coupez le brocolis en bouquets et faites-les cuire à la vapeur pendant 15 minutes. Ensuite ecrasez les légumes avec le dos d'une fourchette.
703;149;3;Ajoutez alors la crème et la gousse d'ail épluchée et pressée. Mélangez et assaisonnez en sel. 
704;149;4;Abaissez la pate au rouleau à patisserie sur une épaisseur de 3-5 mm. Avec un emporte-pièce de 9cmø, découpez des ronds de pate. Au centre disposez 1 c. à café de préparation au brocolis et ajoutez un morceau de fromage. Refermez votre empanadas et sceller celui-ci avec les dents d'une fourchette.
705;149;5;Badigeonnez de jaune d'oeuf ou de lait et enfournez à 200°C pendant 15 minutes. Dégsutez aussitot.
706;149;6;Il est possible de remplacer le fromage a raclette par de la mozzarella, de la feta, du fromage de chèvre ou du reblochon.
707;150;1;Versez de l'eau dans uen casserole avec le bouillon de légume et laissez infuser. Ajoutez ensuite le riz et faites-le cuire sur feu doux.
708;150;2;Versez les bouquets de chou-fleur dans une grande poele avec un fond d'huile d'olive pour les faire dorer. Ajoutez ensuite un fond d'eau et couvrez la poele. Faites cuire les bouquets jusqu'à ce qu'ils soient fondants et reservez.
709;150;3;Dans un faitout ou poele versez le lait de coco, avec le beurre de cacahuète, une pincée de sel et le sucre complet. Mélangez sur feu doux et assaisonnez selon vos gouts avec le curry, cumin et gingembre en poudre. N'hésitez pas à assaisonnez surtout pour donner du gout ! Laissez mijoter sur feu doux jusqu'à obtenir uen sauce plsu crémeuse.
710;150;4;Ajoutez alors les bouquets de chou-fleur cuit et mélangez pour bien les impregner de sauce.
711;150;5;Enfin dressez vos assiettes avec le riz, et vos légumes. Coupez un peu de ciboulette dessus et savourez aussitpit !
712;150;6;Les choux-fleurx peuvent etre remplacés par du chou romanesco, du poulet, du tempeh, des pois chiches ou du tofu.
713;151;1;Épluchez et émincez l'oignon. Coupez les pieds des champignons et taillez-les en lamelles. Puis épluchez et pressez la gousse d'ail. Ajoutez ces ingrédients dans un faitout avec de l'huile d'olive et faites-les dorer jusqu'à ce qu'ils soient fondants.
714;151;2;En meme temps faites bouillir l'eau avec le bouillon de légumes et mélangez.
715;151;3;Ajoutez les flocons d'avoine et de pois chiches dans le faitout. Mélangez et laissez-les s'impregner de la saveur des autres ingrédients.
716;151;4;Comme un risotto ajoutez le bouillon louche par louche dans le faitout en veillant à ce que le bouillon s'evapore entre chaque ajout. Le bouillon une fois terminé, vous devez avoir un porridge bien crémeux.
717;151;5;Ajoutez alors la crème, les épices et le sel selon vos gouts. Laissez mijoter pour faire réduire un peu la crème. Réservez.
718;151;6;Coupez le poulet en morceaux et faites-le revenir avec de l'huile d'olive. Une fois doré, ajoutez la moutarde, la crème et la levure maltée. Mélangez sur feu doux pour que la viande s'imprègne bien.
719;151;7;Dans une assiette creuse, servez le porridge salé avec les morceaux de poulet sur le dessus et régalez-vous.
720;151;8;N'hésitez pas à varier les saveurs en remplaçant les flocons d'avoine et pois chiches par d'autres flocons de céréales ou légumineuses.
721;152;1;Coupez le tempeh en batonnets et versez-le dans une marinade composée de sauce soja et de vinaigre balsamique. Laissez-le minimum 2H et pas plus d'une journée.
722;152;2;Coupez la base des choux et champignon et coupez-les ensuite en 2 ou 4. Rincez-les sous l'eau claire si besoin. Faites-les revenir dans un faitout avec de l'huile de sésame et le surplus de marinade du tempeh.
723;152;3;Les légumes une fois cuit, versez-les dans 2 assiettes creuses et gardez le jus de cuisson. Réservez.Dans la meme poele, faites cuire le tempeh pour qu'il soit bien doré sur chaque face et disposez-le dans les assiettes creuses.
724;152;4;Pour le bouillon faites chauffer simplement de l'eau avec une bonne c. à café de miso d'orge et le bouillon de poule. Faites bouillir le bouillon et versez les tagliatelles de riz complet, puis faites-les cuire 4 minutes (voir paquet).
725;152;5;Versez le bouillon et les tagliatelles dans les assiettes creuses et dégustez aussitot.
726;152;6;Pour avoir une recette végétarienne, remplacez le bouillon de poule par du bouillon de légumes.
727;153;1;Dans un faitout versez de l'huile d'olive avec du riz. Mélangez et faites cuire le riz quelques minutes jusqu'à ce que les grains de riz soient transparents.
728;153;2;Dans une grande casserole versez l'eau et le bouillon de légumes jusqu'à ce que le bouillon soit dissout. Ajoutez ensuite une louche de bouillon dans le riz, et une fois le bouillon absorbé, versez une autre louche et ainsi de suite jusqu'à épuisement.
729;153;3;Quand vous aurez ajouté 2-3 louches de bouillon, ajoutez les champignons coupés en morceaux et continuez la cuisson.
730;153;4;Une fois tout le bouillon ajouté, versez la crème de soja et le parmesan rapé. Mélangez sur feu doux. Le risotto une fois crémeux, assaisonnez avec un peu de sel selon vos gouts et servez aussitot.
731;153;5;Il est possible d'ajouter des oignons émincés dès le début de la cuisson si vous le souhaitez. Si vous utilisez des champignons frais, comptez 1kg de champignons.
732;154;1;Faites-cuire les filets de poulet à la vapeur pendant 25 minutes pour qu'ils soient bien blanchit à coeur. Ensuite à l'aide de 2 fourchettes, effilochez la viande.
733;154;2;Coupez les pieds des champignons, puis coupez-les en lamelles. Versez-les dans un faitout et faites-les revenir avec un peu d'huile d'olive. 
734;154;3;Les champignons une fois cuits, ajoutez la moitié de la crème et le poulet effiloché. Versez ensuite le bouillon de légume éffrité ainsi que le parmesan rapé. Mélangez et laissez mijoter à feu doux jusqu'à ce que la préparation soit plus crémeuse. Laissez refroidir.
735;154;4;Avec une cuillère à café garnissez vos cannellonis avec la préparation au poulet. Disposez-les dans un plat à gratin.
736;154;5;Dans une casserole, versez la chair de tomate avec le reste de crème. Mélangez et ajoutez le sucre complet pour adoucir l'acidié de la tomate. Mélangez et versez la préparation sur les cannellonnis. Saupoudrez de parmesan rapé et enfournez à 180°C pendant 40 min.
737;154;6;Pour en faire un plat plus festif et raffiné, remplacez les champignons de Paris par des morilles ou des cèpes.
738;155;1;Lavez et coupez les poireaux en fines lamelles. Faites-les cuire à la vapeur pendant 30 minutes jusqu'à ce qu'ils soient fondants.
739;155;2;Égouttez-les bien, puis faites-les revenir dans un faitout avec de la crème, du bouillon de légume, du gingembre et de la fleur de sel selon vos gouts. Mélangez sur feu doux et laissez réduire jusqu'à obtenir un mélange crémeux.
740;155;3;Versez la fondu sur un plat de service et faites revenir rapidement vos noix de Saint Jacques dans une poele avec du beurre clarifié jusqu'à ce qu'elles soient dorées. Disposez-les sur la fondu de poireau et saupoudrez simplement de fleur de sel.
741;155;4;La fondu de poireau peut etre cuite avec du parmesan rapé ou du fromage de chèvre frais si vous le souhaitez. Enfin faites bien cuire les noix de St Jacques avec du beurre clarifié qui leurs donnera un gout de noisette.
742;156;1;Rincez tous les légumes, puis épluchez et émincez les oignons. Ensuite épluchez et coupez en rondelles les carottes. Coupez la base des chou pak choi et coupez-les en lamelles. Enfin coupez les poireaux en deux dans la longueur, et coupez-les en lamelles.
743;156;2;Versez de l'huile d'olive dans le faitout et ajoutez les oignons sur feu moyen. Mélangez. Ajoutez ensuite les carottes. Couvrez et mélangez de temps à autres.
744;156;3;Ajoutez ensuite les poireaux et les choux. Mélangez. Ajoutez un fond d'eau bouillante et couvrez. Baissez le feu. Effritez les bouillons de légumes et versez-les. Mélangez de temps à autre et laissez mijoter pendant 20 minutes.
745;156;4;Découvrez le faitout, augmentez le feu et faites réduire le bouillon de moitié. Ensuite sur le dessus, ajoutez les différents poissons et la tete de la dorade pour le gout. Par dessus saupoudrez le mélange d'épices pour poisson, le panch phoron, le sel et une bonne pincée de poivre du Timut. 
746;156;5;Baissez sur feu doux et couvrez. Coupez le citron en rondelles, enlevez les pépins et ajoutez-les autour du poisson. Couvrez.
747;156;6;Une fois que les poissons sont juste cuits et nacrés, et reservez-les sur une assiette avec le citron. Mélangez les légumes.
748;156;7;Ajoutez le beurre clarifié et la crème de soja, mélangez et assaisonnez selon vos gouts avec le sel et le poivre du Timut. Personnellement j'ai ajouté encore un peu de mélange d'épices pour poisson afin d'accentuer le gout.
749;156;8;Avant de servir, mélangez et disposez sur le dessus les morceaux de poissons et servez aussitot.
750;156;9;Réalisez cette recette suivant les légumes de saison. Vous pouvez ainsi utiliser des brocolis, choux de Bruxelles, chou kale.. Enfin vous pouvez moins réduire le bouillon et ajouter des nouilles chinoises pour un coté plus asiatique.
751;157;1;Dans la cuve du robot versez la levure de boulanger avec un fond d'eau tiède et laissez la levure s'activer. Ensuite versez la farine avec le reste d'eau, l'huile d'olive, le sucre et le sel. Mélangez puis pétrissez la pate jusqu'à ce qu'elle soit souple et homogène.
752;157;2;Filmez et mettez le récipient dans le four éteint pour faire pousser la pate pendant 3h env.
753;157;3;Épluchez et émincez les échalotes et oignons. Puis coupez le pied des champignons et coupez-les en lamelles.Versez-les oignons et échalotes dans un grand faitout et faites-les revenir avec de l'huile d'olive. Ensuite ajoutez les champignons. Mélangez à feu doux, puis assaisonnez selon vos gouts avec du sel et du persil. Reservez et laissez refroidir.
754;157;4;Lavez les feuilles d'épinards et versez-les dans un faitout avec de l'huile d'olive. Faites-les suer. Elle vont ensuite de ramollir, à se moment, ajoutez la crème et la moitié de moutarde. Mélangez et laissez cuire jusqu'à ce que le mélange soit crémeux. Reservez.
755;157;5;Divisez la pate en 2 morceaux. Abaissez le premier à paton avec un rouleau à patisserie, au centre tartinez de moutarde.
756;157;6;Ajoutez dessus le mélange de champignon en couche uniforme. 
757;157;7;Ajoutez par dessus les pavés de saumon (ou un grand filet). 
758;157;8;Puis ajoutez par dessus les épinards. Réservez. 
759;157;9;Faites bouillir de l'eau, une fois à ébullition, versez les oeufs de cailles et faites-les cuire 4 minutes chrono. Ensuite écalez vos oeufs sous l'eau froide.
760;157;10;Disposez vos oeufs sur les épinards. Abaissez la 2 eme pate sur une épaisseur de 5 mm.  et disposez-la sur les différentes couches de préparation. Pincez les bords avec les dents d'une fourchette et coupez l'excédent de pate. 
761;157;11;Avec ces chutes de pate, réalisez des tresses par exemple et différentes forme à l'aide de vos emporte-pièces et disposez-les dessus.
762;157;12;Mettez la préparation dans le four éteint et faites-la lever de nouveau 45 minutes.
763;157;13;Sortez-la du four et préchauffez celui-ci à 200°C. Dans un ramequin versez du lait et de la cardamome, puis badigeonnez le koulibiac avec. Enfournez alors celui-ci pendant 20-25minutes et servez-aussitot.
764;157;14;Si vous n'aimez pas les épinards, remplacez-les par des brocolis ou choux de Bruxelles par exemple.
765;158;1;Épluchez les pommes de terre, rincez-les sous l'eau claire puis faites-les cuire à la vapeur pendant 40 minutes environ, jusqu'à ce qu'elles soient fondantes. Dans le panier du bas, ajoutez les filets de poulet.
766;158;2;Ensuite passez-les au presse-purée, puis ajoutez de la crème et du lait. Mélangez jusqu'à obtenir une purée onctueuse. Ajoutez ensuite les gousses d'ail épluchées et pressées et assaisonnez selon vos gouts en sel. 
767;158;3;Épluchez et émincez échalottes et oignons. Versez-les dans une grande poele avec de l'huile d'olive. Mélangez et laissez cuire quelques minutes. Ajoutez ensuite les champignons épluchés et coupés en lamelles. Mélangez.
768;158;4;Effilochez le poulet à l'aide d'une fourchette ou à la main et ajoutez-le au reste de la préparation. Mélangez.
769;158;5;Pour terminer, ajoutez la crème et assaisonnez selon vos gouts avec du sel, de l'origan, du persil et du cumin. Mélangez.
770;158;6;Huilez un plat à gratin, versez la préparation au poulet sur le fond pour former une couche homogène. Puis versez la purée par dessus.
771;158;7;Dans un ramequin mélangez le sésame, le sel, les herbes et la levure. Mélangez et ajoutez cette préparation au dessus du hachis. Puis enfournez à 200°C pendant 20 min et dégustez aussitot.
772;158;8;Pour une version végétarienne, vous pouvez remplacer le poulet par des proteines de soja.
773;159;1;Épluchez, videz et coupez le butternut en morceaux. Reservez.Ensuite coupez les extrémités du poireaux, coupez-le en deux dans sa longueur et passez-le sous l'eau pour enlever la terre. Coupez-le en lamelles.
774;159;2;Versez vos légumes dans le cuiseur vapeur et laissez cuire pendant 40 minutes jusqu'à  ce que qu'ils soient fondants.
775;159;3;Réduisez les morceaux de butternut en purée, puis assaisonnez avec le gingembre, le sel et la muscade selon vos gouts.
776;159;4;Dans un plat à gratin, disposez sur le fond un peu d'huile d'olive, la purée de butternut, une feuille de pate à lasagne et de nouveau un peu de purée.
777;159;5;Égouttez les poireaux et ajoutez de la crème de riz. Mélangez.
778;159;6;Ensuite versez les morceaux de poireau, les morceaux de saumon frais, de nouveau de la purée, une feuille de pate à lasagne et recouvrez de purée restante. Ajoutez par dessus un peu de levure maltée.
779;159;7;Mettez un fond d'eau dans la grande cocotte, disposez le plat de lasagne. Ensuite faites cuire vos lasagnes pendant 40 minutes. Soit maxi en haut pendant toute la cuisson, et pour le bas 15 minutes maxi, puis le reste du temps en position mini. Enfin Laissez refroidir 15 minutes avant d'ouvrir la cocotte.
780;159;8;Il est possible de remplacer le butternut par du potimarron et le poireau par des epinards en ajoutant également un peu de chèvre frais.
781;160;1;Faites fondre le beurre clarifié dans un ramequin et ajoutez-y une gousse d'ail épluchée et pressée. Mélangez.
782;160;2;Coupez 3 belles tranches de pain et versez dessus le beurre fondu. Disposez ensuite 2 tranches de bacon au dessus de chaque tranche de pain.
783;160;3;Coupez la tome en tranches et disposez-les sur chaque tranche de pain. Ensuite enfournez-les à 200°C pendant 7-8 minutes .
784;160;4;Servez-les avec des pommes de terre et choux de Bruxelles cuits à la vapeur avec un peu de fleur de sel.
785;160;5;Il est possible de remplacer le pain au sésame par du pain complet et la tome de Savoie par du reblochon ou du fromage de chèvre pour une tartine un peu plus légère.
786;161;1;Coupez le dessus du reblochon et ajoutez la gousse d'ail épluchée et pressée avec une pointe de fleur de sel. Refermez le reblochon et enfournez-le pendant 20 minutes à 180°C.
787;161;2;Pendant ce temps faites cuire votre poisson dans une poele avec un mélange de beurre clarifié, jus de citron et un peu de fleur de sel. Une fois nacré, arretez la cuisson.
788;161;3;Servez votre reblochon roti avec des pommes de terre vapeur, le poisson, le fromage et dégustez.
789;161;4;Si vous n'avez pas de Reblochon, il est possible de faire cette recette avec un vacherin  ou un camembert.Pour le poisson, optez pour un poisson blanc car le fromage est déjà gras.
790;162;1;Coupez les brocolis en bouquets et faites-les cuire à la vapeur jusqu'à ce qu'ils soient fondants. Ensuite mixez-les et ajoutez la crème. Mixez de nouveau et versez la crème dans une casserole. 
791;162;2;Ajoutez ensuite le bouillon de légume, le beurre clarifié et enfin le parmesan rapé. Mélangez sur feu doux. Une fois que la préparation est bien homogène. Assaisonnez si besoin en sel. Réservez.
792;162;3;Coupez le poulet en morceaux et faites-le revenir avec de l'huile d'olive. En meme temps, faites cuire les pates dans de l'eau bouillante salée et égouttez-les.
793;162;4;Dans un faitout ou une grande poele versez la crème de brocolis avec les pates et le poulet cuit. Mélangez puis versez aussitot.
794;162;5;Il est possible de remplacer le parmesan par du Beaufort, de l'Abondance ou du comté. Pour le brocolis, il peut etre remplacé par du chou fleur.
795;163;1;Frottez et coupez les pommes de terre en dés. Ensuite épluchez et émincez les oignons. Faites revenir le tout dans une poele avec un peu d'huile d'olive. Réservez.
796;163;2;Pendant ce temps, coupez les extrémités des poireaux. Coupez-les ensuite dans la longueur et rincez-les sous l'eau pour enlever la terre. Puis coupez-les en lamelles. Faites-les cuire dans le cuiseur vapeur jusqu'à ce qu'ils soient fondants.* Il est possible de cuire également les morceaux de pommes de terre de cette manière.
797;163;3;Une fois que la poireau est cuit, versez-le dans le faitout des pommes de terre. Ajoutez alors la crème et mélangez.
798;163;4;Préchauffez le four à 200°C et huilez le moule à gratin. 
799;163;5;Coupez le Reblochon en morceaux.
800;163;6;Versez 1/3 des morceaux sur le fond du moule, par dessus la moitié de la préparation aux poireaux, puis 1/3 de Reblochon, le reste des poireaux et enfin le fromage. Les différents étages de la préparation doivent etre versées de façon uniforme. Ensuite enfournez le plat pendant 20 minutes et dégustez aussitot.
801;163;7;Pour se rapprocher un peu plus de la recette tarditionnelle, vous pouvez ajouter du bacon dans cette recette.
802;164;1;Coupez la base du pied des champignons et épluchez les chapeaux de ceux-ci si besoin. Ensuite coupez-les en lamelle. Versez-les dans un grand faitout.
803;164;2;Épluchez et coupez les oignons en lamelles et ajoutez-les dans le faitout.
804;164;3;Versez de l'huile d'olive et faites revenir vos légumes jusqu'à ce qu'ils blanchissent pour les oignons et brunissent pour les champignons.
805;164;4;Ajoutez ensuite de la crème avec le bouillon et laissez mijoter. Mélangez et laissez réduire doucement jusqu'à ce que la crème s'épaisisse et qu'elle se colore avec les champignons.
806;164;5;Pendant ce temps, coupez les filets de poulet en morceaux et faites-les revenir dans une poele avec un peu d'huile d'olive. Une fois juste dorés, ajoutez-les dans la crème pour que la viande s'imprègne bien.
807;164;6;Dégustez ce poulet à la crème avec des pate d'épeautre complet, ce sera parfait.
808;164;7;Pour une version végétarienne, remplacez le poulet par du tempeh ou du tofu.
809;165;1;Dans un bol versez le jus de citron, la sauce soja et le sirop. Mélangez et ajoutez le tempeh coupé en morceaux. Mélangez et laissez mariner au frais pendant 1h minimum.
810;165;2;Passé ce temps, faites-les revenir dans une poele avec la marinade et reservez. Ne lavez pas la poele car le jus servira à cuire les champignons.
811;165;3;Épluchez, coupez et videz le butternut. Faites-le cuire à la vapeur jusqu'à ce qu'il soit bien fondant. Versez-le dans le mixeur encore chaud et ajoutez le beurre clarifié, la ricotta et l'eau chaude. Mixez jusqu'à ce que la sauce soit homogène.
812;165;4;Épluchez et hachez l'ail et l'oignon. Faites-les revenir à la poele avec un peu d'huile pendant 5-10 minutes. Ajoutez ensuite ces ingrédients dans le mixeur. Mixez de nouveau et assaisonnez selon vos gouts avec la muscade et le sel. Mélangez.
813;165;5;Faites tremprz les tagliatelles dans l'eau froide pendant 10 minutes, puis versez-les dans l'eau bouillante salée pendant 3 minutes et égouttez-les.
814;165;6;Pendant ce temps, coupez la base du pied des champignons et coupez-les en lamelles. Faites-les revenir avec un peu de beurre clarifié dans la poele du tempeh.
815;165;7;Versez la sauce dans un wok sur feu doux et ajoutez les tagliatelles. Mélangez-les délicatement dans la sauce pour ne pas les casser. Versez-les dans les assiettes avec les champignons et le tempeh. Dégustez aussitot.
816;165;8;Il est possible de remplacer les tagliatelles par d'autres pates.
817;166;1;Épluchez les pommes de terre, coupez-les en morceaux et faites-les cuire à la vapeur jusqu'à ce qu'elles soient fondantes. Ajoutez-les ensuite dans le mixeur avec le beurre clarifié et la crème d'avoine.
818;166;2;Mixez jusqu'à obtenir de la purée homogène, assaisonnez en sel et poivre. Réservez.
819;166;3;Lavez et rapez les courgettes. Versez-les dans le récipient et ajoutez les flocons d'avoine, le fromage rapée et la levure maltée. Mélangez.
820;166;4;Épluchez les oignons et gousses. Pressez les gousses et ajoutez-les, puis émincez l'oignon et ajoutez-le également. Mélangez et versez l'équivalent d'une bonne cuillère à soupe sur la poele. Réalisez une forme de galette et faites cuire dans l'autre sens.
821;166;5;Servez enfin la purée avec les croquettes et dégustez.
822;166;6;Il est possible de remplacer la purée de pomme de terre par de la purée de carotte, de celeri ou de pois cassés.
823;167;1;Coupez vos courges en deux et videz-les. Disposez-les sur la plaque du four, ajoutez de l'huile d'olive et du sel dans chacunes d'elles. Faites-les cuire pendant 20 minutes à 200°C. Réservez.
824;167;2;Faites griller les amandes puis versez-les dans le mixeur. Réduisez-les en poudre. Ajoutez dans celui-ci les gousses d'ail épluchées et pressées, l'huile d'olive, les feuilles d'origan, le jus de citron et la pincée de sel à ajouter selon vos gouts. Mixez votre pesto  jusqu'à obtenir une sauce homogène et lisse. Réservez.
825;167;3;Coupez le brocolis et le chou romanesco en petits bouquets. Faites-les cuire à la vapeur pendant 20 minutes. Reservez.
826;167;4;Versez le pesto dans la poele avec la tome de brebis rapée et la crème. Mélangez jusqu'à ce que la préparation soit homogène. Assaisonnez en sel selon vos gouts. Ajoutez alors les légumes cuits. Mélangez.
827;167;5;Grattez le fond des courges à l'aide d'une fourchette et ajoutez la préparation au pesto au centre. Puis enfournez de nouveau les courges à 200°C pendant 15 minutes et dégustez aussitot.
828;167;6;"Il est également possible de remplacer le choux romanesco et le brocolis par des choux de bruxelles, avec des champignons ou oignons; voire meme des pates."
829;168;1;Versez la semoule de blé dans un récipient avec de l'eau. Laissez poser la semoule pendant 3h pour que les grains se gonflent et versez-les avec l'eau dans un wok. Faites chauffer à feux moyen jusqu'à ce que l'eau s'évapore complètement.
830;168;2;Ajoutez ensuite le beurre clarifié avec le curry, cumin et gingembre. Salez selon votre gout et mélangez. Reservez
831;168;3;Coupez le chou-fleur en bouquets puis versez-les dans une grande poele à feu moyen. Versez le jus de citron, la sauce soja et le sucre complet. Faites cuire vos bouquets jusqu'à ce que la sauce soit complètement évaporée. 
832;168;4;Vous devez avoir au bout de 15-20 minutes, une sauce sirupeuse et caramelisée qui enveloppe votre chou-fleur.
833;168;5;Versez la semoule dans des assiettes et ajoutez par dessus le chou-fleur. Ajoutez des amandes et pistaches concassées et dégustez aussitot.
834;168;6;La semoule peut etre remplacée par du quinoa, bolgour, quinoa ou riz.
835;169;1;Versez le riz dans un récipient avec son eau et laissez reposer pendant 3h, le temps que le riz gonfle.
836;169;2;Épluchez et émincez l'oignon. Versez-le dans la poele et ajoutez le beurre clarifié. Une fois doré et cuit, versez le riz et l'eau dans une casserole et faites-le cuire sur feu doux jusqu'à ce que l'eau soit complètement évaporée.
837;169;3;Ajoutez ensuite le lait de coco. Mélangez et ajoutez les différents épices ainsi que le sel. 
838;169;4;Mélangez et laissez le riz mijoter jusqu'à ce que toute la sauce soit absorbée. Laissez-le reposer.
839;169;5;Coupez les filets de poulet en morceaux. Versez-les ensuite dans une grande poele avec le beurre clarifié, les gousses d'ail épluchées et pressées et l'oignon épluché et émincé. Mélangez et faites dorer le tout sur feu moyen.
